"ID","Title","Column","OwnerRole","Deliverable","PlanLink","Notes"
"ST-B-001","Investigate WLLS snapshot/materialize regression","In Progress","Ingestion/Performance","DeviceRepository now hydrates shared cache snapshots automatically. 2025-11-28 pipeline + incremental checklist refreshed telemetry (SnapshotImported=3, InitNewStore=15, InitReuseStore=6, GetMiss=50/GetHit=24); WLLS AccessCacheHit=5/AccessRefresh=0; BOYO providers still Unknown; queue delay summary skipped (0 samples); PortBatchReady remains synthetic/minimal (1 sw1 batch) after dispatcher sweep (Logs/DispatchHarness/RoutingQueueSweep-checklist-20251128-095600.json). 2025-12-17: TelemetryModule now batches telemetry writes (flush-on ParseDuration/SkippedDuplicate) and ParserPersistenceModule reuses shared-cache entries to avoid redundant GetHit calls; Quick mock BOYO/WLLS pipeline now ~7s wall time with ParseDuration ~2.4s/0.35s and DatabaseWriteLatency ~290ms/99ms. 2025-12-20: Warm regression attempt failed the port batch diversity guard (WLLS streak 19 > limit 8); warm pass aborted. Artifacts: Logs/Reports/PortBatchSiteDiversity-2025-12-20.json, Logs/Reports/PortBatchReady-2025-12-20.json, Logs/Reports/InterfaceSyncTiming-2025-12-20.json. 2025-12-20: Warm regression rerun with -SkipPortDiversityGuard completed the cold pass but failed in Invoke-WarmRunTelemetry.ps1 (Collect-TelemetryForPass missing Count property); warm pass aborted and no WarmRunTelemetry emitted. Artifacts: Logs/Reports/PortBatchReady-2025-12-20.json, Logs/Reports/InterfaceSyncTiming-2025-12-20.json, Logs/Reports/ParserSchedulerLaunch-2025-12-20.json. 2025-12-21: Warm regression rerun with -SkipPortDiversityGuard completed cold+warm passes but failed warm-run validation (157 hosts without SiteCacheProvider=Cache; 37 hosts without HostMapSignatureMatchCount; rewrote 1,440 cached host entries). No WarmRunTelemetry emitted; queue delay summary missing (0 samples). Artifacts: Logs/IngestionMetrics/2025-12-21.json, Logs/Reports/PortBatchReady-2025-12-21.json, Logs/Reports/InterfaceSyncTiming-2025-12-21.json, Logs/Reports/ParserSchedulerLaunch-2025-12-21.json, Logs/SharedCacheSnapshot/SharedCacheSnapshot-20251221-070128.clixml. 2025-12-20: Warm regression rerun after telemetry fixes completed warm pass but failed warm-run validation (missing DatabaseWriteBreakdown/InterfaceSyncTiming; 37 hosts without SiteCacheProvider=Cache; 1 host missing HostMapSignatureMatchCount; rewrote 168 cached host entries). No WarmRunTelemetry emitted. Artifacts: Logs/Reports/PortBatchReady-2025-12-20.json, Logs/Reports/InterfaceSyncTiming-2025-12-20.json, Logs/Reports/ParserSchedulerLaunch-2025-12-20.json, Logs/IngestionMetrics/QueueDelaySummary-2025-12-20.json, Logs/SharedCacheSnapshot/SharedCacheSnapshot-20251220-230155.clixml, Logs/SharedCacheSnapshot/SharedCacheSnapshot-20251220-230430.clixml. 2025-12-20: Expanded mock corpus (routing host list clones) + interface dispatch harness flushed queue metrics; queue delay summary now passes (SampleCount=8, QueueBuildDelay p95=12.43 ms / p99=16.65 ms). PortBatchReady report reflects 35 hosts; updated snapshot Logs/SharedCacheSnapshot/SharedCacheSnapshot-20251220-144919.clixml and queue summary Logs/IngestionMetrics/QueueDelaySummary-2025-12-20.json. 2025-12-20: Site-cache materialization skips template lookup when PortColor/ConfigStatus already set; diag pipeline on BOYO/WLLS logs SnapshotImported=4, GetMiss=96/GetHit=2 (Logs/IngestionMetrics/2025-12-20.json, Logs/SharedCacheSnapshot/SharedCacheSnapshot-20251220-135800.clixml).","docs/plans/PlanB_Performance.md","Next: analyze warm pass cache misses (157 non-Cache, 37 signature misses) and rerun warm regression with -SkipWarmValidation to export WarmRunTelemetry; run provider-reason diagnostics against Logs/IngestionMetrics/2025-12-21.json."
"ST-B-002","Trial reduced auto-scale ceilings post-batching","Done - 2025-12-22","Ingestion","2025-12-22 pipeline run with overrides (MaxWorkersPerSite=1, MaxActiveSites=1) captured ParseDuration/DatabaseWriteLatency metrics and concurrency profile; recommendation logged.","docs/plans/PlanB_Performance.md","Command: Tools\\Invoke-StateTracePipeline.ps1 -SkipTests -VerboseParsing -ResetExtractedLogs -MaxWorkersPerSiteOverride 1 -MaxActiveSitesOverride 1; ParseDuration p95 1.176s (avg 0.914s, max 3.414s); DatabaseWriteLatency p95 1009.8ms (avg 743.6ms, max 1255ms); ConcurrencyProfileResolved ResolvedMaxWorkersPerSite=1 ResolvedMaxActiveSites=1 ResolvedThreadCeiling=8 ResolvedJobsPerThread=4 ManualOverrides=True; Pool MaxThreads=1. Recommendation: keep defaults (write latency p95 exceeds 950ms cold gate). Artifacts: Logs/IngestionMetrics/2025-12-22.json, Logs/Reports/ParserSchedulerLaunch-2025-12-22.json, Logs/Reports/PortBatchReady-2025-12-22.json, Logs/Reports/InterfaceSyncTiming-2025-12-22.json."
"ST-B-003","Codify concurrency overrides","Done - 2025-12-22","Automation","2025-12-22: Added concurrency override guard and pipeline telemetry logging; runbook mapping updated.","docs/plans/PlanB_Performance.md","Tools/ConcurrencyOverrideGuard.psm1 resets non-baseline concurrency settings in Data/StateTraceSettings.json after pipeline runs; pipeline logs ConcurrencyOverrideSummary telemetry; Modules/Tests/ConcurrencyOverrideGuard.Tests.ps1 added; docs/CODEX_RUNBOOK.md updated with override→metric mapping."
"ST-A-001","Verify InterfaceSync timing completeness","Done - 2025-11-14","Ingestion/Routing","Telemetry completeness verified on 2025-11-14 (PortBatchReady=128, InterfaceSync=384, ParserSchedulerLaunch=86 / scheduler guard MaxObservedStreak=1) with analyzer JSON + history CSVs (`Logs/Reports/PortBatchReady-2025-11-14.json`, `Logs/Reports/InterfaceSyncTiming-2025-11-14.json`, `Logs/Reports/ParserSchedulerLaunch-2025-11-14.json`, `Logs/Reports/*History.csv`).","docs/plans/PlanA_RoutingReliability.md","Bundle cites `Logs/IngestionMetrics/2025-11-14.json` + `Logs/IngestionMetrics/QueueDelaySummary-20251114.json` and history CSV entries."
"ST-D-002","SPAN view investigation follow-up","Done - 2025-11-12","UI","Doc updates linking Tools/Invoke-SpanViewSmokeTest.ps1 + Get-SpanViewSnapshot so SPAN harness is repeatable.","docs/plans/PlanD_FeatureExpansion.md","See docs/README.md and docs/CODEX_RUNBOOK.md rows."
"ST-D-001","Document incremental loading UX metrics","Done - 2025-11-12","Docs","Operators runbook + Codex runbook updated with telemetry capture instructions.","docs/plans/PlanD_FeatureExpansion.md","Reference docs/StateTrace_Operators_Runbook.md and docs/CODEX_RUNBOOK.md."
"ST-D-003","Incremental loading telemetry sweep","Done - 2025-11-14","UI + Ingestion","2025-11-14 telemetry bundle carries PortBatchReady-2025-11-14.json + analyzer outputs and ParserSchedulerLaunch-2025-11-14.json now reports MaxObservedStreak=1 after the guard/analyzer updates.","docs/plans/PlanD_FeatureExpansion.md","Fairness evidence: Logs/Reports/ParserSchedulerLaunch-2025-11-14.json + history CSVs."
"ST-D-010","Investigate WLLS->BOYO idle gap","In Progress","UI + Scheduler","Site-pair, timeline, site-mix, sweep-order, diversity guard, scheduler-vs-port outputs, and the new balanced Hostname dropdown (`DeviceCatalogModule\Get-DeviceSummaries` now rotates sites) prove the parser guard stays at streak 1 while PortBatchReady still shows 25 WLLS events; next step: scrape dispatcher harness timelines / scheduler overrides and trial the balanced host list (Tools/New-BalancedRoutingHostList.ps1 -> Data/RoutingHosts_Balanced.txt).","docs/plans/PlanD_FeatureExpansion.md","Bundle queue sweep logs + scheduler notes before closing."
"ST-E-002","Automate metric rollup schedule","Done - 2025-11-12","Telemetry","Tools/Invoke-DailyMetricRollup.ps1 plus README/runbook guidance for daily summaries.","docs/plans/PlanE_Telemetry.md","Outputs timestamped IngestionMetricsSummary-<timestamp>.csv files."
"ST-G-003","Codex plan automation matrix","Done - 2025-11-12","Docs/Governance","Created docs/CODEX_PLAN_AUTOMATION_MATRIX.md and added cross-links so agents know which scripts/telemetry/doc touchpoints apply per plan.","docs/plans/PlanG_ReleaseGovernance.md","Mentioned in README + instruction stack."
"ST-G-004","Doc sync playbook","Done - 2025-11-12","Docs/Governance","Added docs/CODEX_DOC_SYNC_PLAYBOOK.md and updated the instruction stack/operations guide so handoffs always include plan + Task Board + backlog updates.","docs/plans/PlanG_ReleaseGovernance.md","Referenced in README and plan timeline."
"ST-A-005","Dispatcher alert integration","Done - 2025-12-22","Ingestion/Telemetry","Dispatcher harness flushes telemetry buffer; queue delay summary Logs/IngestionMetrics/QueueDelaySummary-2025-12-22.json (20 samples, QueueBuildDelay p95 25.60 ms, p99 33.57 ms) sourced from Logs/IngestionMetrics/2025-12-22.json. Scheduler telemetry now flushes at parse completion and analyzer ignores synthesized events when real launches exist; pipeline run passes scheduler fairness (max streak 1) in Logs/Reports/ParserSchedulerLaunch-2025-12-22.json and docs/performance/SchedulerVsPortDiversity-2025-12-22.md. Port batch diversity guard uses synthesized events; Logs/Reports/PortBatchSiteDiversity-2025-12-22.json max streak 1.","docs/plans/PlanA_RoutingReliability.md",""
"ST-A-006","Routing evidence bundle linkage","Done - 2025-12-22","Ingestion/PMO","Routing bundle published at Logs/TelemetryBundles/Routing-20251222/Routing (queue summary + dispatcher harness sweep + session log + scheduler comparison).","docs/plans/PlanA_RoutingReliability.md",""
"ST-A-007","Roadmap M2: Routing discovery baseline","Backlog","PMO/Routing","Roadmap M2 (docs/StateTrace_Quarterly_Roadmap.md): discovery sessions + canonical RouteRecord/RouteHealthSnapshot schemas + routing data architecture notes; exit criteria: stakeholder-aligned route definitions, telemetry inventory gap analysis, reviewed diagrams.","docs/plans/PlanA_RoutingReliability.md",""
"ST-B-008","Publish warm-run telemetry bundles","Backlog","Ingestion/PMO","Run Tools/Publish-TelemetryBundle.ps1 after each cold+warm run to copy cold/warm telemetry, shared-cache analyzers, diff hotspots, and doc-sync notes into Logs/TelemetryBundles/<bundle>/.","docs/plans/PlanB_Performance.md",""
"ST-B-009","Toggle skip-site-cache policy safely","In Progress","Ingestion","Guard module now flips SkipSiteCacheUpdate off/on for pipeline (-DisableSkipSiteCacheUpdate), warm-run telemetry, and shared-cache warmup; runbook updated. Warm harness now emits comparisons even when DB writes are sparse. Latest guarded run (WarmRunTelemetry-20251201-guard-skipdiv7.json, port diversity guard skipped) improved vs cold (+8.95%: warm avg 898.585 ms, cold 986.951 ms); warm providers Cache=2,302/Refresh=182/Hydrate=20/MissingDatabase=62 (WarmCacheHitRatioPercent=89.71, SignatureMatchMissCount=176); queue summary emitted; shared-cache analyzer shows SnapshotImported=1 (still low) and GetMiss=170. Earlier guarded run (logs moved to DebugLogs/) had warm AccessCacheHit=14/AccessRefresh=0 with queue delay p95/p99=0.47/0.87 ms).","docs/plans/PlanB_Performance.md",""
"ST-B-010","Roadmap M1: Multi-DB ingestion foundation","Backlog","Ingestion/Performance","Roadmap M1 (docs/StateTrace_Quarterly_Roadmap.md): per-site queue + adaptive runspace pool, incremental persistence + parameterized commands, nightly Maintain-AccessDatabases.ps1 compaction; exit criteria: no ACE/JET contention at 8 workers, throughput drop <=5% when doubling DBs, 14-day maintenance run success.","docs/plans/PlanB_Performance.md",""
"ST-C-001","Roadmap M3: Diff prototype & launch metrics instrumentation","Backlog","Parser/Analytics","Roadmap M3 (docs/StateTrace_Quarterly_Roadmap.md): diff data model prototype + metrics in Logs/Research/DiffPrototype, Phase 1 telemetry dictionary, launch metrics dashboard wireframes; exit criteria: diff prototype emits versioned snapshots, telemetry events stored locally, wireframes approved.","docs/plans/PlanC_ChangeTracking.md",""
"ST-E-003","Schedule daily rollup harness","Done - 2025-12-22","Telemetry","Use Tools/Schedule-DailyRollupTask.ps1 (or CI) to register the daily rollup harness and log cadence + CSV path in Plan E.","docs/plans/PlanE_Telemetry.md","Re-registered StateTraceDailyRollup to repo path; manual rollup (Days=30) wrote Logs/IngestionMetrics/IngestionMetricsSummary-20251222-060953.csv. Reran Invoke-StateTracePipeline with -SkipPortDiversityGuard to generate same-day metrics and scheduled task run succeeded (Last Result=0), producing Logs/IngestionMetrics/IngestionMetricsSummary-20251222-071331.csv; queue delay summary had 0 samples; InterfaceSyncTiming summary empty."
"ST-E-007","Release-readiness telemetry bundle","Backlog","Telemetry/PMO","Produce Logs/TelemetryBundles/<date>/ bundles via Tools/Publish-TelemetryBundle.ps1 (auto-discovers rollup CSVs, analyzers, warm summaries, doc-sync refs) and verify per docs/runbooks/Telemetry_Bundle_Verification.md (README hash + readiness output logged).","docs/plans/PlanE_Telemetry.md",""
"ST-E-008","Task board alignment","Backlog","Telemetry","Keep Task Board + CSV entries current for telemetry tasks/bundle links.","docs/plans/PlanE_Telemetry.md",""
"ST-E-009","Plan A telemetry bundle handoff","Backlog","Telemetry/Routing","Ensure Tools/Publish-TelemetryBundle.ps1 runs include routing/dispatcher logs from Plan A ST-A-006 (use -AreaName Routing).","docs/plans/PlanE_Telemetry.md",""
"ST-F-003","NetOps session log enforcement","Done - 2025-11-13","Automation/Security","Tools/Test-NetOpsEvidence.ps1 + Tools/Invoke-AllChecks.ps1 -RequireNetOpsEvidence ensure NetOps/reset logs (with reasons) and session references exist whenever STATETRACE_AGENT_ALLOW_* is used; lint now skips directory resolution when offline.","docs/plans/PlanF_SecurityIdentity.md",""
"ST-F-009","Online-mode reset automation","Done - 2025-11-13","Automation/Security","Tools/Reset-OnlineModeFlags.ps1 -Reason \<plan/task>\"" clears STATETRACE_AGENT_ALLOW_*","records the reason","and writes Logs/NetOps/Resets/OnlineModeReset-<timestamp>.json; cite the log path + reason in Plan F updates"
"ST-G-001","Update release checklist with shared cache snapshot policy","Done - 2025-12-22","Release","Added shared cache snapshot verification steps to docs/Release.md referencing SharedCacheSnapshot-latest-summary.json and Tools/Test-SharedCacheSnapshot.ps1.","docs/plans/PlanG_ReleaseGovernance.md",""
"ST-G-002","Link roadmap milestones to task board IDs","Done - 2025-12-22","PMO","Added Task Board IDs to the Q4 roadmap and created matching milestone cards (ST-A-007/ST-B-010/ST-C-001) in the Task Board/CSV.","docs/plans/PlanG_ReleaseGovernance.md",""
"ST-G-006","Doc-sync enforcement hook","Done - 2025-12-22","Docs/Governance","Added Tools/Test-DocSyncChecklist.ps1 to validate plan/task board/backlog/session log updates and emit JSON summaries; Tools/Invoke-AllChecks.ps1 supports -RequireDocSyncChecklist with auto-output; runbook/playbook/checklist updated.","docs/plans/PlanG_ReleaseGovernance.md",""
"ST-G-007","Telemetry bundle integration","Backlog","Release/Telemetry","Require telemetry bundle links (Tools/Publish-TelemetryBundle.ps1 / Tools/New-TelemetryBundle.ps1), run Tools/Test-TelemetryBundleReadiness.ps1 -IncludeReadmeHash -SummaryPath per docs/runbooks/Telemetry_Bundle_Verification.md, and record README hashes + VerificationSummary.json path before approvals.","docs/plans/PlanG_ReleaseGovernance.md",""
"ST-G-008","Risk register linkage","Backlog","PMO","Reference relevant RiskRegister entries + mitigations inside bundle README and release notes.","docs/plans/PlanG_ReleaseGovernance.md",""
"ST-H-001","Launch user onboarding + freshness visibility","In Progress","UI/Docs","Quickstart anchor added to Operators runbook, UI smoke checklist updated, headless harness emits a summary (`-SummaryPath`), toolbar Help opens the quickstart anchor, and the toolbar shows last-ingest freshness per site. Next: add cache-source telemetry and capture UI screenshots.","docs/plans/PlanH_UserExperience.md",""
"ST-H-004","Fix search/alerts port sorting","Done - 2025-12-19","UI","Search + Alerts views sort ports by PortSort keys; async refresh proceeds when interface data is already loaded even if InterfacesLoadAllowed is false, and the Insights worker merges queued view requests so search/alerts refresh is not dropped by later updates.","docs/plans/PlanH_UserExperience.md",""
"ST-H-005","Headless Search/Alerts smoke harness","Done - 2025-12-19","UI","Added Tools/Invoke-SearchAlertsSmokeTest.ps1 to load Search/Alerts in a hidden WPF host and assert grid binding; UI smoke checklist + Codex runbook now call out the headless check and require it for new UI features/functions, and Tools/Invoke-AllChecks.ps1 runs it by default.","docs/plans/PlanH_UserExperience.md",""
"ST-E-010","Harden telemetry buffer concurrency","Done - 2025-12-19","Telemetry","Telemetry buffer and shared cache event arrays now use runspace-safe locks to prevent concurrent list mutation; Pester pass.","docs/plans/PlanE_Telemetry.md",""
"ST-K-005","Code review findings remediation (batch 1)","Done - 2025-12-21","Automation","Address high-severity items from docs/notes/2025-12-21_code_review_findings.md and log status updates there; findings 1-3, 4-6, 7-14, 15-33, 34-54, 55-63, 65-69, 70-76, 72, 77, 81-86, 88-98, and 99-100 complete; 64 verified locked (schema warnings, DeviceDetails/Insights diagnostics, parser/filter/repo cleanup warnings, cache event caps, module import warnings, tooling JSON helper, streamed telemetry parsing, cache sync, bounded polling/timeouts, export dialog suppression with view/headless opt-in).","docs/plans/PlanK_DeveloperExperience.md",""

